{
  "schema_version": "1.0.0",
  "repository": "Pick-Your-AI/pick-your-ai-datasets",
  "program_id": "DATA",
  "external_parent": "https://github.com/Pick-Your-AI/pick-your-ai-research/issues/509",
  "project": {
    "title": "Pick Your AI — Datasets & Benchmark Research",
    "number": 11,
    "url": "https://github.com/orgs/Pick-Your-AI/projects/11",
    "description": "Evidence-backed research on AI datasets and benchmarks: identity, versions, rights, provenance, evaluation integrity and integrations.",
    "fields": [
      {
        "name": "Status",
        "data_type": "SINGLE_SELECT",
        "options": [
          "Backlog",
          "Ready",
          "In Progress",
          "In Review",
          "Blocked",
          "Done"
        ]
      },
      {
        "name": "Priority",
        "data_type": "SINGLE_SELECT",
        "options": [
          "P0",
          "P1",
          "P2",
          "P3"
        ]
      },
      {
        "name": "Record Type",
        "data_type": "SINGLE_SELECT",
        "options": [
          "Program",
          "Epic",
          "Work Package"
        ]
      },
      {
        "name": "Workstream",
        "data_type": "SINGLE_SELECT",
        "options": [
          "Program",
          "01 Scope, taxonomy and governance",
          "02 Dataset discovery and source inventory",
          "03 Modality coverage",
          "04 Dataset identity, versions and relationships",
          "05 Licensing, access, consent and rights",
          "06 Provenance, quality, bias and reproducibility",
          "07 Benchmark datasets and grading semantics",
          "08 Evaluation integrity and comparability",
          "09 Metadata storage, manifests and recovery",
          "10 Cross-repository integration",
          "11 Search, directory and consumer experience",
          "12 Contribution, freshness and maintenance"
        ]
      },
      {
        "name": "Readiness",
        "data_type": "SINGLE_SELECT",
        "options": [
          "Ready",
          "Needs Input",
          "Awaiting Decision",
          "Blocked"
        ]
      },
      {
        "name": "Dataset Modality",
        "data_type": "SINGLE_SELECT",
        "options": [
          "Cross-modal",
          "Text",
          "Code",
          "Image",
          "Video",
          "Speech & Audio",
          "Multimodal",
          "Time Series",
          "Tabular",
          "Geospatial",
          "Robotics",
          "Scientific",
          "Graph & Structured",
          "Not Applicable"
        ]
      },
      {
        "name": "Dataset Category",
        "data_type": "SINGLE_SELECT",
        "options": [
          "Cross-category",
          "Training Corpus",
          "Fine-tuning & Instruction",
          "Evaluation Benchmark",
          "Retrieval & Embedding Corpus",
          "Safety & Red-team",
          "Synthetic",
          "Domain/Specialized",
          "Not Applicable"
        ]
      },
      {
        "name": "Access Classification",
        "data_type": "SINGLE_SELECT",
        "options": [
          "Not Assessed",
          "Open",
          "Registration Required",
          "Gated/Approval",
          "Restricted/Sensitive",
          "Commercial/Paid",
          "Mixed",
          "Not Applicable"
        ]
      },
      {
        "name": "License/Rights Status",
        "data_type": "SINGLE_SELECT",
        "options": [
          "Not Assessed",
          "Under Review",
          "Permitted for Metadata Use",
          "Conditional",
          "Restricted",
          "Withdrawn/Disputed",
          "Not Applicable"
        ]
      },
      {
        "name": "Evidence Confidence",
        "data_type": "SINGLE_SELECT",
        "options": [
          "Unverified",
          "Low",
          "Medium",
          "High"
        ]
      },
      {
        "name": "Source Freshness",
        "data_type": "SINGLE_SELECT",
        "options": [
          "Not Collected",
          "Current",
          "Due for Refresh",
          "Stale",
          "Not Applicable"
        ]
      },
      {
        "name": "Dependency Status",
        "data_type": "SINGLE_SELECT",
        "options": [
          "Unblocked",
          "Waiting",
          "Blocked"
        ]
      },
      {
        "name": "Effort",
        "data_type": "SINGLE_SELECT",
        "options": [
          "XS",
          "S",
          "M",
          "L",
          "XL"
        ]
      },
      {
        "name": "Release Phase",
        "data_type": "SINGLE_SELECT",
        "options": [
          "Foundation",
          "Discovery",
          "Metadata Pilot",
          "Integration",
          "Directory Beta",
          "Maintenance"
        ]
      },
      {
        "name": "Acceptance Status",
        "data_type": "SINGLE_SELECT",
        "options": [
          "Not Started",
          "In Progress",
          "Changes Requested",
          "Accepted",
          "Deferred"
        ]
      }
    ],
    "views": [
      {
        "name": "Program Overview",
        "layout": "TABLE_LAYOUT",
        "filter": "is:issue repo:Pick-Your-AI/pick-your-ai-datasets record-type:Program,Epic",
        "group_by": null,
        "sort_by": [
          "Workstream"
        ],
        "visible_fields": [
          "Title",
          "Assignees",
          "Status",
          "Priority",
          "Record Type",
          "Release Phase",
          "Acceptance Status",
          "Sub-issues progress"
        ]
      },
      {
        "name": "Epic Hierarchy",
        "layout": "TABLE_LAYOUT",
        "filter": "is:issue repo:Pick-Your-AI/pick-your-ai-datasets record-type:Epic,\"Work Package\"",
        "group_by": "Workstream",
        "sort_by": [
          "Title"
        ],
        "visible_fields": [
          "Title",
          "Assignees",
          "Status",
          "Record Type",
          "Priority",
          "Readiness",
          "Parent issue",
          "Sub-issues progress"
        ]
      },
      {
        "name": "Research Coverage",
        "layout": "TABLE_LAYOUT",
        "filter": "is:issue repo:Pick-Your-AI/pick-your-ai-datasets record-type:\"Work Package\" -dataset-modality:\"Not Applicable\"",
        "group_by": "Dataset Category",
        "sort_by": [
          "Priority"
        ],
        "visible_fields": [
          "Title",
          "Assignees",
          "Status",
          "Dataset Modality",
          "Dataset Category",
          "Evidence Confidence",
          "Source Freshness"
        ]
      },
      {
        "name": "By Modality",
        "layout": "TABLE_LAYOUT",
        "filter": "is:issue repo:Pick-Your-AI/pick-your-ai-datasets record-type:\"Work Package\" -dataset-modality:\"Not Applicable\"",
        "group_by": "Dataset Modality",
        "sort_by": [
          "Priority"
        ],
        "visible_fields": [
          "Title",
          "Assignees",
          "Status",
          "Dataset Modality",
          "Workstream",
          "Readiness"
        ]
      },
      {
        "name": "Licensing and Rights",
        "layout": "TABLE_LAYOUT",
        "filter": "is:issue repo:Pick-Your-AI/pick-your-ai-datasets workstream:\"05 Licensing, access, consent and rights\"",
        "group_by": "License/Rights Status",
        "sort_by": [
          "Priority"
        ],
        "visible_fields": [
          "Title",
          "Assignees",
          "Status",
          "Access Classification",
          "License/Rights Status",
          "Readiness",
          "Acceptance Status"
        ]
      },
      {
        "name": "Evidence Verification",
        "layout": "TABLE_LAYOUT",
        "filter": "is:issue repo:Pick-Your-AI/pick-your-ai-datasets -record-type:Program evidence-confidence:Unverified,Low",
        "group_by": "Evidence Confidence",
        "sort_by": [
          "Priority"
        ],
        "visible_fields": [
          "Title",
          "Assignees",
          "Status",
          "Evidence Confidence",
          "Source Freshness",
          "Workstream"
        ]
      },
      {
        "name": "Blocked Dependencies",
        "layout": "TABLE_LAYOUT",
        "filter": "is:issue repo:Pick-Your-AI/pick-your-ai-datasets dependency-status:Waiting,Blocked",
        "group_by": "Dependency Status",
        "sort_by": [
          "Priority"
        ],
        "visible_fields": [
          "Title",
          "Assignees",
          "Status",
          "Readiness",
          "Dependency Status",
          "Workstream"
        ]
      },
      {
        "name": "Active Research",
        "layout": "TABLE_LAYOUT",
        "filter": "is:issue repo:Pick-Your-AI/pick-your-ai-datasets status:\"In Progress\",\"In Review\"",
        "group_by": "Status",
        "sort_by": [
          "Priority"
        ],
        "visible_fields": [
          "Title",
          "Assignees",
          "Status",
          "Priority",
          "Workstream",
          "Acceptance Status"
        ]
      },
      {
        "name": "Publication Readiness",
        "layout": "TABLE_LAYOUT",
        "filter": "is:issue repo:Pick-Your-AI/pick-your-ai-datasets record-type:\"Work Package\" -acceptance-status:Accepted,Deferred",
        "group_by": "Release Phase",
        "sort_by": [
          "Priority"
        ],
        "visible_fields": [
          "Title",
          "Assignees",
          "Status",
          "Release Phase",
          "License/Rights Status",
          "Acceptance Status"
        ]
      },
      {
        "name": "Unassigned Work",
        "layout": "TABLE_LAYOUT",
        "filter": "is:issue repo:Pick-Your-AI/pick-your-ai-datasets no:assignee -status:Done",
        "group_by": "Workstream",
        "sort_by": [
          "Priority"
        ],
        "visible_fields": [
          "Title",
          "Assignees",
          "Status",
          "Priority",
          "Readiness",
          "Workstream"
        ]
      }
    ]
  },
  "representation": {
    "native_issues": [
      "Program",